{"availability":{"accepted_count":4,"excluded_count":2,"exclusion_reason_counts":{"INTEGER_NOT_EXACTLY_REPRESENTABLE":0,"METRIC_ABSENT":1,"VALUE_UNAVAILABLE":1},"total_records":6},"producer_artifacts":[{"artifact_id":"producer-a","layout":"candidate_evidence_list_v1","metric_name":"syn-a:/iptm","record_count":2,"sha256":"4c590e6f547cc07d937b1da02c0c732aaf5e8f852a87b969b9aef97a369c1776"},{"artifact_id":"producer-b","layout":"candidate_evidence_v1","metric_name":"syn-b:/iptm","record_count":1,"sha256":"c9cbed4c2cf5e563e4a5af0aa36fa6cb9824052634a654b0b2737c9dd4f64588"},{"artifact_id":"producer-c","layout":"candidate_evidence_list_v1","metric_name":"syn-c:/iptm","record_count":3,"sha256":"c1dc5b66f7bac646072f95ca6353fb0c7ea84e4efc8d0e8e8d5d98cf866ca58e"}],"quantity":{"category":"model_confidence","context":"complex","quantity_id":"syn-iptm","scale":"0-1","unit":null},"rules":{"compatibility":"each selected metric's category, unit and scale equal the declared quantity; null matches only null","identity":"summary_id = SHA-256 of the canonical JSON of the document without summary_id","mean":"math.fsum(values) / count","median":"values ordered by (value, value_id); middle value for odd count, lower/2 + upper/2 for even count","ordering":"producer_artifacts by artifact_id; values by (artifact_id, record_index); call order is ignored","selection":"explicitly selected producer artifacts only; no discovery, glob, default or latest-output lookup","statistics":"count, min, median, max and mean over accepted values only; null when no value is accepted"},"schema_version":"quantity_summary/1","statistics":{"count":4,"max":0.8,"mean":0.67,"median":0.665,"min":0.55,"status":"SUMMARIZED"},"summary_id":"e56df891e65f3e427c3b1b2877185a6e0fc4c8feaf3f3e626be44fc3e7075f6d","values":[{"artifact_id":"producer-a","candidate_id":"syn-a1","conformer_id":null,"exclusion_detail":null,"exclusion_reason":null,"metric_index":0,"metric_name":"syn-a:/iptm","producer_provenance":{"checkpoint_id":null,"model_id":"synthetic-model","seed":0},"record_index":0,"source":{"path":"/synthetic/producer-a/confidence.json","row":null,"sha256":"f8546546c0c04ca3c0eabf21e8326077d7792095fb178e9d4b3dd05a3b3a3773"},"status":"accepted","target_id":"syn-target","value":0.62,"value_id":"producer-a#0"},{"artifact_id":"producer-a","candidate_id":"syn-a2","conformer_id":null,"exclusion_detail":null,"exclusion_reason":null,"metric_index":0,"metric_name":"syn-a:/iptm","producer_provenance":{"checkpoint_id":null,"model_id":"synthetic-model","seed":0},"record_index":1,"source":{"path":"/synthetic/producer-a/confidence.json","row":null,"sha256":"f8546546c0c04ca3c0eabf21e8326077d7792095fb178e9d4b3dd05a3b3a3773"},"status":"accepted","target_id":"syn-target","value":0.71,"value_id":"producer-a#1"},{"artifact_id":"producer-b","candidate_id":"syn-b1","conformer_id":null,"exclusion_detail":null,"exclusion_reason":null,"metric_index":0,"metric_name":"syn-b:/iptm","producer_provenance":{"checkpoint_id":null,"model_id":"synthetic-model","seed":0},"record_index":0,"source":{"path":"/synthetic/producer-b/confidence.json","row":null,"sha256":"2ba352a263d8c3a9ca92f044ecadebe2508705cad9c33b88ec3e6845e136e3c3"},"status":"accepted","target_id":"syn-target","value":0.55,"value_id":"producer-b#0"},{"artifact_id":"producer-c","candidate_id":"syn-c1","conformer_id":null,"exclusion_detail":"no metric ('complex', 'syn-c:/iptm'); name present in contexts ['monomer']","exclusion_reason":"METRIC_ABSENT","metric_index":null,"metric_name":"syn-c:/iptm","producer_provenance":null,"record_index":0,"source":null,"status":"excluded","target_id":"syn-target","value":null,"value_id":"producer-c#0"},{"artifact_id":"producer-c","candidate_id":"syn-c2","conformer_id":null,"exclusion_detail":"missing_value","exclusion_reason":"VALUE_UNAVAILABLE","metric_index":0,"metric_name":"syn-c:/iptm","producer_provenance":{"checkpoint_id":null,"model_id":"synthetic-model","seed":0},"record_index":1,"source":{"path":"/synthetic/producer-c/confidence.json","row":null,"sha256":"56194d80accfdda9c5a88327e7bc4bacee55b0f57895363a83d91c9c4fe34759"},"status":"excluded","target_id":"syn-target","value":null,"value_id":"producer-c#1"},{"artifact_id":"producer-c","candidate_id":"syn-c3","conformer_id":null,"exclusion_detail":null,"exclusion_reason":null,"metric_index":0,"metric_name":"syn-c:/iptm","producer_provenance":{"checkpoint_id":null,"model_id":"synthetic-model","seed":0},"record_index":2,"source":{"path":"/synthetic/producer-c/confidence.json","row":null,"sha256":"56194d80accfdda9c5a88327e7bc4bacee55b0f57895363a83d91c9c4fe34759"},"status":"accepted","target_id":"syn-target","value":0.8,"value_id":"producer-c#2"}]}
